index,audio,avg_prob,type,text,text_ts,human_verified
958,/workspace/datasets/whisper_prep_dataset/train/created_dataset/dump/YSKJxaTai8o/2283730.mp3,-0.06784460036682763,term,Маленьких месторождений И они все заходят у тебя На один УПН На одну установку подготовки нефти Почему бы СПИ и ПРМС Объединяет все месторождения И как раз параллельно Вместе с ним Ты сможешь сдать Проект разработки И начать добычу И время это деньги И,"<|0.00|> месторождений, и они все заходят у тебя там где-то на один<|4.00|><|4.00|> УПН, на одну установку подготовки нефти.<|6.96|><|7.76|> То есть, почему бы SP и PRMS, он же как раз объединяет все<|12.62|><|12.62|> месторождения, и как раз параллельно с ним, вместе с ним ты<|17.52|><|17.52|> сможешь сдать проект разработки.<|20.80|><|21.80|> И начать добычу.<|22.52|><|22.60|> И начать добычу, и время – это деньги.<|25.36|>",False
20,/workspace/datasets/whisper_prep_dataset/train/created_dataset/dump/WfcldGf1Xoc/328600.mp3,-0.06780196103500202,term,"Однако, возможно бурение специальной скважины или даже группы скважин для увеличения охвата воздействием большего объема нефтенасыщенной части пласта или его слабо проницаемых зон. Избирательную систему заводнения применяют при выработке запасов нефти из сильно неоднородных прерывистых как по простиранию, так и по толщине коллекторов. Точки бурения нагнетательных скважин определяют.","<|0.00|> Однако, возможно бурение специальной скважины или даже<|3.78|><|3.78|> группы скважин для увеличения охвата воздействием большего<|7.90|><|7.90|> объема нефтенасыщенной части пласта или его слабо проницаемых<|11.82|><|11.82|> зон.<|12.70|><|13.60|> Избирательную систему заводнения применяют при выработке<|17.24|><|17.24|> запасов нефти из сильно неоднородных прерывистых как по<|20.64|><|20.64|> простиранию, так и по толщине коллекторов.<|23.80|><|23.80|> Точки бурения нагнетательных скважин определяют с учетом<|27.40|>",False
65,/workspace/datasets/whisper_prep_dataset/train/created_dataset/dump/xbrsbYaj-gU/980900.mp3,-0.06694852664440987,term,"Применением автоматизированных систем управления процессами извлечения полезных ископаемых из метров, развитие методов детального учета строения пластов и характера протекающих в них процессов на основе детерминированных моделей, реализуемых на мощных компьютерах. Разработка нефтяных напряжений – это также самостоятельная, комплексная область науки и инженерная дисциплина, которая имеет свои специальные,","<|0.00|> применением автоматизированных систем управления процессами<|3.28|><|3.28|> излечения полезных ископаемых из недр,<|5.32|><|5.82|> развитием методов детального учета строения пластов и<|9.22|><|9.22|> характера протекающих в них процессах<|11.24|><|11.24|> на основе детерминированных моделей, реализуемых на мощных<|14.72|><|14.72|> компьютерах.<|15.76|><|17.30|> Разработка нефтяных месторождений – это также самостоятельная,<|21.90|><|21.90|> комплексная область науки<|23.34|><|23.34|> и инженерная дисциплина, которая имеет свои специальные<|26.74|>",False
938,/workspace/datasets/whisper_prep_dataset/train/created_dataset/dump/YSKJxaTai8o/1736920.mp3,-0.06689677083133054,noise,"И, соответственно, здесь должно быть полное доверие такому десанту, который за короткий период времени полное доверие, и тогда эффект обеспечен. Супер. Надеюсь, у вас уникальный, если честно, пример, опыт, который можно предпринимать, то есть можно реализовать в других месторождениях. Еще один из, наверное, актуальных тем...","<|0.00|> И, соответственно, здесь должно быть полное доверие такому<|4.58|><|4.58|> десанту, который...<|7.18|><|7.18|> За короткий период времени.<|8.18|><|8.24|> Да, за короткий период времени.<|9.54|><|9.92|> Полное доверие, и тогда эффект обеспечен.<|13.26|><|13.48|> Обеспечен.<|13.92|><|14.66|> Супер, надеюсь, у вас уникальный, если честно, пример, опыт,<|19.72|><|19.72|> который может предпринимать, то есть может реализовать в<|23.34|><|23.34|> других месторождениях.<|24.36|><|25.08|> А вот еще один из, наверное, актуальных тем, ну это каждая,<|29.48|>",False
907,/workspace/datasets/whisper_prep_dataset/train/created_dataset/dump/YSKJxaTai8o/870640.mp3,-0.06678761123524359,term,Пример Месторождение Ампа Это получается Бруней Есть месторождение Накико Примерно одинаковые Накико это Мексиканский залив Там примерно одинаковые условия были То есть Пласты работали на Газонапорном режиме После того как газовая шапка истощилась Давление у нас упало И,"<|1.12|> Пример.<|1.96|><|4.18|> Месторождение АМПа, это получается, это Бруней.<|8.12|><|8.80|> Есть месторождение Накико, примерно одинаковые...<|13.02|><|13.02|> То есть, Накико, это Мексиканский залив, там примерно одинаковые<|17.60|><|17.60|> условия были.<|18.54|><|18.70|> То есть, пласты работали на газонапорном режиме.<|24.08|><|24.16|> После того, как газовая шапка истощилась, давление у нас упало.<|27.88|>",False
17,/workspace/datasets/whisper_prep_dataset/train/created_dataset/dump/WfcldGf1Xoc/247330.mp3,-0.06623468117322773,term,"устранить или уменьшить блокировку нагнетаемой воды и повысить охват пласта воздействием. Блочное заводнение следовательно на больших неоконтуренных месторождениях, когда, по данным разведочных скважин, очевидна промышленная нефтеносность в районе их расположения. В этом случае до окончательной разведки месторождения и определения контуров нефтеносности возможен ускоренный в","<|0.00|> устранить или уменьшить блокировку нагнетаемой воды и повысить<|4.22|><|4.22|> охват пласта воздействием.<|6.20|><|6.96|> Блочное заводнение целесообразно на больших неоконтуренных<|10.44|><|10.44|> месторождениях, когда, по данным разведочных скважин, очевидна<|15.16|><|15.16|> промышленная нефтяносность в районе их расположения.<|18.60|><|18.60|> В этом случае до окончательной разведки месторождения и<|22.44|><|22.44|> определения контуров нефтяносности возможен ускоренный ввод<|26.82|>",False
1014,/workspace/datasets/whisper_prep_dataset/train/created_dataset/dump/YSKJxaTai8o/3855760.mp3,-0.06620668520918116,term,"И мы в процессе эксплуатации не понимаем, какая плотность флюида у нас, у нас может быть газовая шапка. Короче, это не прямой замер. Погрешность большая, да? Погрешность есть, понимаете? То есть, на уровне давлений, там есть погрешность. То есть, технологии, вот у нас есть, насколько я знаю, компания в Казахстане, которая","<|0.86|> И мы в процессе эксплуатации не понимаем, какая плотность флюида<|6.52|><|6.52|> у нас, у нас может быть газовая шапка.<|8.52|><|9.86|> Короче, это непрямой замер.<|11.40|><|13.50|> Погрешность большая, да?<|14.60|><|15.02|> Погрешность есть, понимаете?<|16.46|><|16.58|> То есть на уровне давлений там есть погрешность, да?<|20.70|><|21.32|> То есть технологии, вот у нас есть, насколько я знаю, компания<|25.96|><|25.96|> в Казахстане,<|27.34|>",False
686,/workspace/datasets/whisper_prep_dataset/train/created_dataset/dump/t0ov4FfyNR0/3241120.mp3,-0.06610463633357237,term,"Буквально 100 метров. И вот иногда такое случается, такие называются природные гейзеры. Как это выглядит, сейчас вам могу рассказать на примере закачки водяного пара. Для тяжелой нефти, которая находится на нескольких десятках метров глубины, закачивает водяной пар. Он под высоким давлением, с высокой температурой идет, идет. И вдруг сверху появляются какие-то трещины. И он туда поднимается вверх. И вот так вот можно случайно сидеть на своем, так сказать,","<|0.44|> буквально там<|0.94|><|0.94|> 100 метров,<|1.54|><|2.14|> и вот иногда<|2.74|><|2.74|> такое случается,<|3.78|><|3.94|> такие называются,<|4.78|><|4.88|> там,<|5.02|><|5.12|> это,<|5.26|><|5.94|> природные гейзеры,<|7.56|><|7.64|> как это выглядит,<|8.24|><|8.24|> как это выглядит,<|8.26|><|8.26|> сейчас вам могу рассказать,<|9.58|><|10.02|> на примере,<|10.72|><|10.76|> там,<|10.92|><|11.34|> закачки водяного пара,<|12.48|><|12.60|> вот,<|12.76|><|12.80|> для тяжелой нефти,<|13.46|><|13.52|> которая находится там<|14.34|><|14.34|> на нескольких десятков метров<|15.32|><|15.32|> глубины,<|15.72|><|16.04|> закачивает водяной пар,<|17.00|><|17.44|> он там под высоким давлением,<|19.00|><|19.12|> с высокой температурой<|20.06|><|20.06|> идет,<|20.30|><|20.42|> идет,<|20.58|><|20.98|> и вдруг,<|21.34|><|21.78|> сверху появляются<|23.78|><|23.78|> какие-то трещины,<|24.44|><|25.02|> и он туда<|25.58|><|25.58|> поднимается вверх,<|26.96|><|27.46|> и вот так вот<|28.14|><|28.14|> можно случайно<|28.86|><|28.86|> сидеть на своем,<|29.62|><|29.68|> так сказать,<|30.00|>",False
50,/workspace/datasets/whisper_prep_dataset/train/created_dataset/dump/xbrsbYaj-gU/554820.mp3,-0.06609114666935056,term,"Третья стадия – значительное снижение добычи нефти. Вы видели это на графике, которая характеризуется снижением добычи нефти в среднем на 10-20% в год при половязке и 3-10% при нефтях с повышенной вязкости. Темпом отбора нефти на конец стадии 1-2,5%. Уменьшением фонда скважины за отключением следствия обводнения продукции –","<|0.00|> Третья стадия – значительное снижение добычи нефти.<|5.56|><|5.62|> Вы видели это на графике, которая характеризуется снижением<|9.80|><|9.80|> добычи нефти.<|10.70|><|10.70|> Средним на 10-20% в год при малой вязкости и 3-10% при нефтях<|15.52|><|15.52|> с повышенной вязкости.<|17.40|><|18.30|> Темпом отбора нефти на конец стадии 1-2,5%.<|22.24|><|22.24|> Уменьшением фонда скважины за отключением вследствие обводнения<|26.24|><|26.24|> продукции.<|27.14|>",False
948,/workspace/datasets/whisper_prep_dataset/train/created_dataset/dump/YSKJxaTai8o/2017720.mp3,-0.0659382845115033,term,Он считает объемный метод И он может усреднить Усреднить и поднять Запасы Или упростить И тут идет увеличение уже на уровне Объемов Второй вопрос это кин Коэффициент извлечения нефти То есть Для зрелых месторождений он может быть завышен Я почему говорю Потому что у меня перед глазами Два коллектора Двух с разных проектов Оба телегенные коллектора,"<|0.00|> Он считает объемный метод, и он может…<|2.68|><|2.68|> Усреднить.<|3.24|><|4.02|> Усреднить и поднять запасы, да.<|6.38|><|6.96|> И тут уже…<|7.78|><|7.78|> Или упростить, да.<|8.64|><|8.84|> Да, упростить, и тут идет увеличение уже на уровне объемов.<|12.32|><|12.48|> Да.<|12.60|><|13.16|> Второй вопрос – это КИН, коэффициент извлечения нефти.<|16.70|><|17.58|> То есть, для зрелых месторождений он может быть завышен.<|22.02|><|22.02|> Я почему говорю, потому что вот у меня перед глазами два<|25.84|><|25.84|> коллектора, двух с разных проектов, оба тиригенные коллектора,<|29.14|>",False
547,/workspace/datasets/whisper_prep_dataset/train/created_dataset/dump/X2l-vaKoIBE/1907860.mp3,-0.06589775099807109,term,"не потерять достаточно сложно. Баженовская свита, по сути, нефтематеринская порода изначально, которая изначально считалась не коллектором, сейчас уже находятся в пути и подходы для того, чтобы ее разрабатывать. Горизонтальные скважины с гидравлическим разрывом пласта видятся одним из ключевых моментов для того, чтобы разрабатывать это. Ащимовские отложения, это наш север, строительство","<|0.00|> потерять, достаточно сложно.<|1.82|><|2.52|> Баженовская свита, это, по сути, нефтематеринская порода изначально,<|6.52|><|6.58|> которая изначально считалась неколлектором.<|8.66|><|9.28|> Сейчас уже находятся пути и подходы для того, чтобы ее разрабатывать.<|14.66|><|15.14|> Горизонтальные скважины с гидравлическим разрывом пласта<|17.92|><|17.92|> видятся одним из ключевых моментов для того, чтобы разрабатывать<|21.54|><|21.54|> это.<|22.02|><|22.56|> Ащимовские отложения, это наш север.<|24.90|>",False
419,/workspace/datasets/whisper_prep_dataset/train/created_dataset/dump/EiFc1LMtrsY/4215660.mp3,-0.06538462701137178,term,"Более легкие продукты из масла. А снизу у вакуумной колонны отводится гудрон. Самая тяжелая фракция с температурой начала кипения. Если пересчитать на атмосферное давление свыше 500-150 градусов. Соответственно, разделяются они обычно по блокам. То есть, там где без вакуума, там где при атмосферном или повышенном давлении перегонка. Это атмосферная трубчатка АТ, так называемая. вакуумный весь блок",<|0.00|> более легкие<|1.00|><|1.00|> продукты из масла<|2.00|><|2.00|> а снизу<|3.00|><|3.00|> вакуумной колонны<|4.00|><|4.00|> отводится гудрон<|5.00|><|5.00|> самая тяжелая фракция<|6.00|><|6.00|> с температурой<|7.00|><|7.00|> начала кипения<|8.00|><|8.00|> если пересчитать<|9.00|><|9.00|> на атмосферное<|10.00|><|10.00|> давление<|11.00|><|11.00|> свыше<|12.00|><|12.00|> 500-550 градусов<|14.00|><|14.00|> соответственно<|16.00|><|16.00|> разделяются<|17.00|><|17.00|> они обычно по блокам<|18.00|><|18.00|> то есть<|19.00|><|19.00|> там где<|20.00|><|20.00|> без вакуума<|21.00|><|21.00|> там где<|22.00|><|22.00|> при атмосферном или повышенном<|23.00|><|23.00|> давлении<|24.00|><|24.00|> перегонка<|25.00|><|25.00|> это атмосферная трубчатка<|26.00|><|26.00|> АТ так называемая<|27.00|><|27.00|> вакуумный<|29.00|><|29.00|> весь блок<|30.00|>,False
1036,/workspace/datasets/whisper_prep_dataset/train/created_dataset/dump/YSKJxaTai8o/4478360.mp3,-0.06537284798396285,term,"Если скважина, колонна так изолирована, и она мониторится сверху, да, постоянным образом, да, периодически, да, если нет никаких нарушений, можем ли мы думать, что месторождение не загрязняет массив и разрабатывается экологически, вот. Ну, потому что используют последние технологии, и у вас бизнес-процесс уже, ну, налажен, да, что вы постоянно мониторите. И люди имеют компетенцию, да, и квалификацию, чтобы мониторить.","<|0.00|> Если скважина, колоннам так изолирована, и она мониторится<|2.98|><|2.98|> сверху, да, постоянным образом, да, периодически, да, если<|6.32|><|6.32|> нет никаких нарушений,<|7.44|><|8.12|> можем ли мы думать, что месторождение не загрязняет массив<|13.10|><|13.10|> и разрабатывается экологически, вот, ну, потому что используют<|18.52|><|18.52|> последние технологии,<|19.80|><|20.18|> и у вас бизнес-процесс уже, ну, налажено, да, что вы<|23.40|><|23.40|> постоянно мониторите, и люди имеют компетенцию, да, и квалификацию,<|28.14|><|28.14|> чтобы мониторить.<|29.90|>",False
66,/workspace/datasets/whisper_prep_dataset/train/created_dataset/dump/xbrsbYaj-gU/1007640.mp3,-0.0652844412252307,term,"Так вот, наукой о разработке нефтяных месторождений называют осуществление научно-обоснованного излечения из недр, содержащих в них углеводородов и сопутствующих им полезных ископаемых.","<|0.00|> разделы, связанные с учением о системах и технологиях<|4.22|><|4.22|> разработки месторождений, планированием и реализацией основного<|8.50|><|8.50|> принципа разработки,<|9.46|><|9.94|> проектированием и регулированием разработки месторождений.<|13.58|><|14.32|> Так вот, наукой о разработке нефтяных месторождений<|19.26|><|19.26|> называют осуществление научно-обоснованного излечения из<|22.66|><|22.66|> недр,<|22.96|><|23.02|> содержащих в них углеводородов и сопутствующих им полезных<|26.42|><|26.42|> ископаемых.<|27.32|>",False
518,/workspace/datasets/whisper_prep_dataset/train/created_dataset/dump/X2l-vaKoIBE/1090100.mp3,-0.06515284357010387,term,"Зная, как та или иная порода, насыщенная тем или иным флюидом, жидкостью или газом, ведет себя по отношению к разным измеряемым величинам, мы можем определять, что там за порода. Главным образом нам интересен коллектор, не коллектор. Что вмещает эта порода. Главным образом нам интересны углеводороды, газ либо нефть, либо вода.","<|0.00|> Зная, как та или иная порода, насыщенная тем или иным флюидом,<|5.70|><|5.70|> то есть жидкостью либо газом, ведет себя по отношению к разным<|11.20|><|11.20|> измеряемым величинам, мы можем определять, что там за порода.<|17.84|><|18.08|> Главным образом нам интересен коллектор, не коллектор.<|20.18|><|21.56|> Что вмещает эта порода, главным образом нам интересны углеводороды,<|25.28|><|25.28|> газ либо нефть, либо вода.<|26.96|>",False
