index,audio,avg_prob,type,text,text_ts,human_verified
376,/workspace/datasets/whisper_prep_dataset/train/created_dataset/dump/EiFc1LMtrsY/2945740.mp3,-0.03726201432032718,term,"любой нефтеперерабатывающий завод направлен на получение продуктов определенного качества. То есть, некачественные продукты, естественно, не нужны. И весь набор процессов нефтепереработки заточен под определенные продукты. Вот здесь вы можете посмотреть по характеристикам автомобильного бензина. У нас эти характеристики определяются техническим регламентом таможенного союза номер 013-2001.",<|0.00|> нефтепереработка любой нефтеперерабатывающий завод это<|2.58|><|3.90|> он направлен на получение продуктов определенного качества<|6.38|><|6.38|> то есть некачественные продукты естественно не нужны и все<|10.14|><|10.50|> весь набор процессов<|12.50|><|13.02|> нефтепереработки он заточен под определенные продукты<|16.02|><|16.62|> вот здесь вы можете посмотреть о<|18.62|><|19.12|> характеристикам автомобильного бензина<|21.12|><|22.50|> у нас эти характеристики определяются техническим регламентом<|26.24|><|26.24|> таможенного союза номер 013 2011<|29.38|>,False
859,/workspace/datasets/whisper_prep_dataset/train/created_dataset/dump/TyJ9baht8kA/225180.mp3,-0.0373962503638015,noise,"Поршень или свап представляет собой трубу диаметром от 25 до 37,5 мм с клапаном в нижней части, открывающимся вверх. На наружной поверхности поршня укреплены эластичные резиновые манжеты, армированные проволочной сеткой. Так как возможности и техническая реализация методов вызова притока и освоения существенно различаются, выбранные лучшего для конкретных условий.","<|0.00|> Поршень или сваб представляет собой трубу диаметром от 25<|5.44|><|5.44|> до 37,5 мм с клапаном в нижней части, открывающимся вверх.<|11.74|><|11.74|> На наружной поверхности поршня укреплены эластичные резиновые<|15.92|><|15.92|> манжеты, армированные проволочной сеткой.<|19.32|><|20.06|> Так как возможности и техническая реализация методов вызова<|23.52|><|23.52|> притока и освоения существенно различаются, выбранные лучшего<|28.20|><|28.20|> для конкретных условий<|29.24|>",False
794,/workspace/datasets/whisper_prep_dataset/train/created_dataset/dump/UExih7oWg4E/2135720.mp3,-0.037469906819751486,connector,"столько, сколько захотят. Сколько должен производить ОПЕК, чтобы сбалансировать рынок. И выясняется, что следующие несколько лет, несмотря на то, что спрос на нефть прогнозируется с ростом все на тот же миллион баррелей в день. Call on OPEC flat. То есть, ОПЕК лишнюю нефть производить не должен. Весь этот дополнительный спрос будет съеден вот этими новыми производителями американского континента. Вот, кстати, забавная вещь, что во времени ОПЕК был","<|0.00|> сколько захотят.<|1.34|><|2.14|> Сколько должен производить ОПЕК, чтобы сбалансировать рынок.<|4.90|><|5.16|> И выясняется, что следующие несколько лет, несмотря на то,<|8.60|><|8.60|> что спрос на нефть прогнозируется с ростом все на тот же<|11.84|><|11.84|> миллион баррелей в день.<|13.58|><|14.94|> Call on OPEC flat.<|16.44|><|17.04|> То есть OPEC лишнюю нефть производить не должен.<|19.98|><|20.14|> Весь этот дополнительный спрос будет съеден вот этими новыми<|23.10|><|23.10|> производителями американского континента.<|25.62|><|25.62|> Вот, кстати, забавная вещь, что во времени ОПЕК ковида было<|29.36|>",False
21,/workspace/datasets/whisper_prep_dataset/train/created_dataset/dump/WfcldGf1Xoc/356010.mp3,-0.03750138003379107,connector,"с учетом детального изучения геологических условий распространения продуктивного пласта, его связи с забойми ближайших добывающих скважин и таким образом, чтобы обеспечить максимально возможную интенсивность вытеснения нефти водой и свести до минимума влияние неоднородности пласта на полноту выработки и конечный коэффициент нефтеотдачи. Вследствие этого нагнетательные скважины оказываются распространены","<|0.00|> детального изучения геологических условий распространения<|3.84|><|3.84|> продуктивного пласта, его связи с забойми ближайших добывающих<|8.04|><|8.04|> скважин и таким образом, чтобы обеспечить максимально<|12.16|><|12.16|> возможную интенсивность вытеснения нефти водой и свести до<|16.04|><|16.04|> минимума влияние неоднородности пласта на полноту выработки<|19.78|><|19.78|> и конечный коэффициент нефтеотдачи.<|22.40|><|22.40|> Вследствие этого нагнетательные скважины оказываются расположенными<|27.36|>",False
361,/workspace/datasets/whisper_prep_dataset/train/created_dataset/dump/EiFc1LMtrsY/2517140.mp3,-0.03757798775600699,term,"в принципе то же самое. Технологическая классификация определяет классы, группы, типы и так далее по составу уже нефти и по потенциальному содержанию в ней нефтепродуктов. Вы можете видеть, что есть классы по содержанию серы в нефти, в бензине, в реактивном топливе и дизельном топливе. Типы по потенциальному содержанию светлых дистиллятных фракций, то есть до 350 градусов. Группа по потенциальному",<|0.00|> принципе то же самое технологическая классификация определяет<|3.80|><|3.80|> классы группы типа и так далее по составу уже нефти<|9.90|><|9.90|> потенциальному содержанию в ней нефтепродуктов вы можете<|12.94|><|12.94|> видеть что есть классы по содержанию серы в нефти в<|18.00|><|18.00|> бензине в реактивном топливе и дизельном топливе типы по<|20.88|><|20.88|> потенциальному содержанию светлых<|23.10|><|23.10|> дистиллятных фракций до из до 350 градусов группу по потенциальному<|27.72|>,False
480,/workspace/datasets/whisper_prep_dataset/train/created_dataset/dump/X2l-vaKoIBE/29020.mp3,-0.03760710828161488,connector,"Мы распределили их следующим образом То есть первый вебинар, который будет сегодня, будет посвящен введению Собственно дискуссии о том, что это такое вообще И два последующих будут конкретно связаны с олимпиадой для бакалавров И олимпиадой для магистратуры и специалитета Мы построим следующим образом У нас час максимум есть на этот диалог","<|0.98|> Мы распределили их следующим образом.<|4.26|><|4.56|> Первый вебинар, который будет сегодня, будет посвящен введению,<|8.98|><|9.54|> собственно, дискуссии о том, что это такое вообще.<|11.78|><|12.46|> И два последующих будут конкретно связаны с Олимпиадой для<|18.28|><|18.28|> бакалавров<|19.64|><|19.64|> и Олимпиадой для магистратуры и специалитета.<|23.08|><|23.78|> Мы построим следующим образом.<|24.94|><|25.06|> У нас час максимум есть на этот диалог.<|28.52|>",False
826,/workspace/datasets/whisper_prep_dataset/train/created_dataset/dump/UExih7oWg4E/3041650.mp3,-0.037850297069720304,connector,"поговорим. Собственно, передающие системы, где проблемы огромны. Но действительно, вот есть проблемы нерегулярности. Отчасти это решается развитой системой передачи энергии. Что если в одном месте солнце не дует, ветер не светит, то где-то все наоборот. И ветер дует, и солнце светит, и в общем где-то избыток, где-то недостаток. Как-то все-таки это можно компенсировать как сбалансированный портфель акций. Отчасти.","<|0.00|> поговорим, собственно, передающие системы, где проблемы<|4.12|><|4.12|> огромны, но, действительно, вот есть проблемы нерегулярности.<|8.76|><|9.96|> Отчасти это решается развитой системой передачи энергии,<|14.28|><|14.28|> что если в одном месте солнце не дует, ветер не светит, то<|17.96|><|17.96|> где-то все наоборот, и ветер дует, и солнце светит, и, в<|20.76|><|20.76|> общем, где-то избыток, где-то недостаток, как-то все-таки<|24.22|><|24.22|> это можно компенсировать, там, как сбалансированный портфель<|28.24|><|28.24|> акций, да, отчасти.<|29.88|>",False
479,/workspace/datasets/whisper_prep_dataset/train/created_dataset/dump/X2l-vaKoIBE/0.mp3,-0.037896243477007374,term,"Я рад приветствовать вас из Чеменского государственного университета, с Чеменской земли, являющейся оператором площадки «Нефтегазовое дело». И совершенно замечательным образом площадка «Нефтегазовое дело» расположена в Тюмени, которую можно назвать столицей нефтегазовой отрасли России. Сегодня мне выпала честь открыть цикл из трех вебинаров.","<|0.00|> Я рад приветствовать вас из Тюменского государственного университета,<|5.14|><|5.70|> с Тюменской земли, являющейся оператором площадки «Нефтегазовое<|9.26|><|9.26|> дело».<|10.00|><|11.02|> И совершенно замечательным образом площадка «Нефтегазовое<|15.34|><|15.34|> дело» расположена как раз таки в Тюмени,<|17.34|><|17.48|> которую можно назвать столицей нефтегазовой отрасли России.<|21.52|><|23.52|> Сегодня мне выпала честь открыть цикл из трех вебинаров.<|29.02|>",False
86,/workspace/datasets/whisper_prep_dataset/train/created_dataset/dump/xbrsbYaj-gU/1577260.mp3,-0.037950959801673886,term,"И следующий подраздел, который мы с вами рассмотрим, техника и технологии эксплуатации скважин. Тоже очень большой подраздел, потому что могут быть многочисленные технические и технологические причины, приводящие к нецелесообразности выделения объектов.","<|0.00|> И следующий подраздел, который мы с вами рассмотрим –<|15.22|><|15.22|> техника и технологии эксплуатации скважин.<|17.00|><|18.76|> Тоже очень большой подраздел,<|21.00|><|22.22|> потому что могут быть многочисленные технические и технологические<|25.52|><|25.52|> причины,<|25.98|><|25.98|> приводящие к нецелесообразности выделения объектов.<|29.00|>",False
471,/workspace/datasets/whisper_prep_dataset/train/created_dataset/dump/EiFc1LMtrsY/5775660.mp3,-0.03799040553788776,connector,"А вот в чем его, в принципе, неудобство? Если у реакции достаточно высокий тепловой эффект, то температура по слою может изменяться. Поэтому, для того, чтобы этого не было, применяют обычно трехфазные различные реактора с псевдожиженным слоем катализатора. При этом псевдожижение может быть как газом, так и жидкостью. При этом, поскольку в псевдожиженном режиме постоянно происходит перемешивание, то есть выравнивание, в принципе, температуры по слою. Поэтому исключены",<|0.00|> вот в чем его<|1.00|><|1.00|> в принципе<|2.00|><|2.00|> неудобства<|3.00|><|3.00|> если<|4.00|><|5.00|> реакции<|6.00|><|6.00|> достаточно высокий<|7.00|><|7.00|> тепловой эффект<|8.00|><|8.00|> то температура<|9.00|><|9.00|> по слою может изменяться<|10.00|><|10.00|> поэтому<|11.00|><|11.00|> для того чтобы этого не было<|12.00|><|12.00|> применяют обычно<|13.00|><|13.00|> трехфазные<|14.00|><|14.00|> различные реактора<|15.00|><|15.00|> слоем катализатора<|16.00|><|16.00|> при этом все дожижение<|17.00|><|17.00|> может быть как газом<|18.00|><|18.00|> так и жидкостью<|19.00|><|19.00|> при этом поскольку<|21.00|><|21.00|> все дожиженном<|22.00|><|22.00|> режиме<|24.00|><|24.00|> постоянное<|25.00|><|25.00|> происходит перемешивание<|26.00|><|26.00|> то есть выравнивание<|27.00|><|27.00|> в принципе температуры<|28.00|><|28.00|> по слою<|29.00|><|29.00|> поэтому<|30.00|>,False
1005,/workspace/datasets/whisper_prep_dataset/train/created_dataset/dump/YSKJxaTai8o/3600460.mp3,-0.03800181001001461,term,"Но пласт на месте не стоит. То есть, когда было спроектировано это оборудование, были одни условия. Спустя 10-15 лет условия меняются. Соответственно, замерные установки тоже должны меняться. Диапазоны. То есть, это все можно. То есть, эти все технологии существуют. Просто необходим полный обзор. Обзор. То есть, это facility review должен проводиться.","<|0.00|> Но пласт на месте не стоит.<|4.30|><|5.18|> То есть, когда было спроектировано это оборудование, были<|7.72|><|7.72|> одни условия.<|8.74|><|9.44|> Спустя 10-15 лет условия меняются.<|12.06|><|12.76|> Соответственно, замерные установки тоже должны меняться.<|15.66|><|15.96|> Диапазоны.<|16.48|><|16.86|> То есть, это все можно.<|17.68|><|17.86|> То есть, эти все технологии существуют.<|19.80|><|19.98|> Просто необходим полный обзор.<|21.84|><|22.90|> Обзор.<|23.18|><|23.18|> То есть, это фасилити-ревью должен проводиться.<|27.78|>",False
483,/workspace/datasets/whisper_prep_dataset/train/created_dataset/dump/X2l-vaKoIBE/110040.mp3,-0.038054497979049175,connector,"И начнем с того, что рассмотрим, что такое вообще нефть и где она есть. Совершенно понятно, что она находится не в озерах, так где же. Находится она под землей в некоторых коллекторах. Это породы, которые обладают определенным свойством. То есть, свойством вмещать в себя жидкости либо газы.","<|0.00|> И начнем с того, что рассмотрим,<|4.34|><|4.54|> что такое вообще нефть и где она есть.<|7.46|><|8.42|> Совершенно понятно, что она находится не в озерах,<|11.88|><|12.24|> как где же.<|12.90|><|13.94|> Находится она под землей в некоторых коллекторах.<|16.96|><|17.60|> Это породы, которые обладают определенным свойством.<|21.80|><|22.12|> То есть свойством вмещать в себя жидкости либо газы<|26.30|>",False
260,/workspace/datasets/whisper_prep_dataset/train/created_dataset/dump/C8QuQzgiBmY/3589240.mp3,-0.03816271703625615,connector,"газораспределительные пункты. Газораспределительная сеть, это подразумевается, возьмем деревню Гадюкино, куда подведен газ. То есть все объединенные между собой дома, это газораспределительная сеть. И формально газ там хранится. А газорегуляторные пункты, это как раз-таки те точки, те узлы, откуда вот эти все трубки идут к каждым домам. И там тоже можно считать,","<|0.00|> и газораспределительные<|1.52|><|1.52|> пункты.<|2.26|><|2.60|> Газораспределительная<|3.34|><|3.34|> сеть,<|3.60|><|3.66|> это подразумевается,<|4.74|><|5.36|> возьмем<|6.88|><|6.88|> деревню<|8.38|><|8.38|> Гадюкино,<|9.08|><|9.48|> куда<|9.66|><|9.66|> подведен<|10.18|><|10.18|> газ.<|10.52|><|10.90|> То есть,<|11.12|><|11.18|> все<|11.44|><|11.44|> объединенные<|12.30|><|12.30|> между собой<|13.24|><|13.24|> дома,<|14.38|><|14.58|> это<|14.78|><|14.78|> газораспределительная<|15.82|><|15.82|> сеть,<|16.12|><|16.28|> и формально<|16.88|><|16.88|> газ там<|17.36|><|17.36|> хранится.<|17.92|><|19.78|> газорегуляторные<|21.00|><|21.00|> пункты,<|21.50|><|21.62|> это как раз<|22.34|><|22.34|> таки<|22.66|><|22.66|> те точки,<|23.40|><|23.60|> те узлы,<|24.08|><|24.28|> откуда<|24.64|><|24.64|> вот эти все<|25.30|><|25.30|> трубки идут<|26.04|><|26.04|> к каждым<|26.48|><|26.48|> домам.<|26.88|><|26.88|> и там<|27.90|><|27.90|> тоже<|28.20|><|28.20|> можно считать<|29.98|>",False
58,/workspace/datasets/whisper_prep_dataset/train/created_dataset/dump/xbrsbYaj-gU/781850.mp3,-0.03817092600677695,term,"или газа через нагнетательные скважины. Первый метод связан с закачкой под большим давлением порядка 20 мегапаскаль в нефтяные пласты воды, прошедшие специальную подготовку. Различают законтурное, внутриконтурное и площадное заводнение нефтяных пластов. Так вот, при законтурном заводнении воду закачивают в пласт через нагнетательные скважины, размещаемые за внешним контуром нефтяносности по периметру залежи.","<|0.00|> или газа через нагнетательные скважины.<|2.44|><|2.44|> Первый метод связан с закачкой под большим давлением, порядка<|6.76|><|6.76|> 20 мегапаскаль,<|7.84|><|8.16|> в нефтяные пласты воды, прошедшие специальную подготовку.<|11.80|><|12.24|> Различают законтурное, внутриконтурное и площадное заводнение<|16.48|><|16.48|> нефтяных пластов.<|18.16|><|20.68|> Так вот, при законтурном заводнении воду закачивают в пласт<|22.84|><|22.84|> через нагнетательные скважины,<|25.52|><|25.96|> размещаемые за внешним контуром нефтяносности по периметру<|29.36|><|29.36|> залежи.<|29.88|>",False
536,/workspace/datasets/whisper_prep_dataset/train/created_dataset/dump/X2l-vaKoIBE/1595280.mp3,-0.038210843205368814,connector,"который плохо фильтруется в породу коллектор, создается высокое давление и порода коллектор, то есть вмещающая нас интересующий горизонт, просто трескается, в нем создается трещина. Эту трещину мы стараемся закрепить для того, чтобы она обратно не закрылась. Происходит это посредством такого искусственно созданного","<|0.00|> который плохо фильтруется в породу коллектор,<|3.26|><|3.86|> создается высокое давление,<|5.40|><|6.12|> и порода коллектор,<|8.16|><|8.34|> то есть, вмещающая нас интересующий горизонт,<|11.88|><|11.94|> вмещающий интересующий горизонт,<|13.32|><|13.64|> просто трескается, в нем создается трещина.<|15.60|><|16.42|> Эту трещину мы стараемся закрепить для того,<|19.26|><|19.40|> чтобы она обратно не закрылась.<|22.50|><|23.46|> Происходит это посредством такого искусственно созданного<|28.50|>",False
