index,audio,avg_prob,type,text,text_ts,human_verified
580,/workspace/datasets/whisper_prep_dataset/train/created_dataset/dump/t0ov4FfyNR0/55360.mp3,-0.04607365638590776,connector,"и с того времени активно начал заниматься в химическом кружке. И уже там к 11 классу понял, что точно выберу это направление и точно буду заниматься научной деятельностью. Потому что мы уже тогда строили определенные научные эксперименты, находили интересные вещи, ну и, конечно, оставляли следы на потолке школьного кабинета химии. Звучит замечательно. А в химии, вот ваша сфера, химия, нефти, нефтехимия, все, что с ней связано,","<|0.00|> И с того времени активно начал заниматься в химическом кружке.<|3.22|><|3.72|> И уже там к 11 классу понял, что точно выберу это направление<|8.24|><|8.24|> и точно буду заниматься научной деятельностью.<|11.04|><|11.62|> Потому что мы уже тогда строили определенные научные эксперименты,<|15.32|><|15.32|> находили интересные вещи,<|17.48|><|17.62|> ну и, конечно, оставляли следы на потолке школьного кабинета<|20.50|><|20.50|> химии.<|21.10|><|22.16|> Звучит бы замечательно.<|23.52|><|23.94|> А в химии, вот ваша сфера, химия, нефть, вот это нефтехимия,<|27.92|><|27.92|> все, что с ней связано,<|29.84|>",False
356,/workspace/datasets/whisper_prep_dataset/train/created_dataset/dump/EiFc1LMtrsY/2374020.mp3,-0.04608604322420433,term,"представить, что можно из нефтей получить. Ну, вот я для примера расскажу. Нафтеновые нефти как раз в Грозном их довольно много было. Там нафтенов содержалось чуть ли не больше 70%, и из этих нефтей получалось очень хорошее топливо для реактивных двигателей, причем для реактивных двигателей сверхзвуковых самолетов. Это связано с тем, что нафтены, циклические углеводороды,",<|0.00|> представить что можно из нефтей получить ну вот я для<|3.90|><|3.90|> примера<|4.10|><|4.10|> расскажу нафтеновые нефти как раз в грозном их довольно<|8.44|><|8.44|> много было<|9.02|><|9.02|> там нафтенов содержалось чуть ли не больше 70 процентов и<|14.98|><|14.98|> из этих нефтей получалось очень хорошее<|18.08|><|18.08|> топливо для реактивных двигателей причем для реактивных<|21.80|><|21.80|> двигателей сверхзвуковых самолетов<|24.96|><|24.96|> это связано с тем что нафтены циклические углеводороды они<|29.18|>,False
528,/workspace/datasets/whisper_prep_dataset/train/created_dataset/dump/X2l-vaKoIBE/1374340.mp3,-0.046099386643618345,term,"Водой, которую мы таким образом вымываем и оттесняем воду из пласта к добывающим скважинам. Скважины, которые нагнетают воду, соответственно, называются нагнетательными, которые добывают, называются добывающими. В ряде случаев для распространенных пластов применяются площадные схемы заводнения, как показано справа.","<|0.00|> водой, которой мы таким образом вымываем и оттесняем воду<|4.00|><|4.00|> из пласта к добывающим скважинам.<|7.18|><|7.68|> Скважины, которые нагнетают воду, соответственно, называются<|10.12|><|10.12|> нагнетательными,<|10.86|><|10.96|> которые добывают, называются добывающими.<|12.96|><|12.96|> В ряде случаев для распространенных пластов применяются<|18.36|><|18.36|> площадные схемы заводнения,<|21.42|><|21.54|> как и показано справа.<|22.54|>",False
467,/workspace/datasets/whisper_prep_dataset/train/created_dataset/dump/EiFc1LMtrsY/5656660.mp3,-0.046157143893651664,question,"только за счет тепла самой реакции. Таких реакторов может быть несколько различных типов. Стандартные реактора – это реактора с стационарным слоем катализатора и с многоступенчатым охлаждением, которые слева изображены. Это радиальный реактор, в котором реакционный объем расположен не горизонтальными слоями, а вертикальными. Вы можете видеть их, они закрашены.",<|0.00|> только за счет<|1.00|><|1.00|> тепла<|2.00|><|2.00|> самой<|3.00|><|3.00|> реакции<|4.00|><|4.00|> таких реакторов<|6.00|><|6.00|> может быть<|7.00|><|7.00|> несколько различных<|8.00|><|8.00|> типов<|9.00|><|9.00|> стандартные реактора<|10.00|><|10.00|> это<|11.00|><|11.00|> реактора<|12.00|><|12.00|> с стационарным<|13.00|><|13.00|> слоем катализатора<|14.00|><|14.00|> и с многоступенчатыми<|15.00|><|15.00|> квинчами<|16.00|><|16.00|> то есть<|17.00|><|17.00|> многоступенчатым<|18.00|><|18.00|> охлаждением<|19.00|><|19.00|> которые слева<|20.00|><|20.00|> изображены<|21.00|><|21.00|> это радиальный реактор<|22.00|><|22.00|> в котором<|23.00|><|23.00|> в принципе<|24.00|><|24.00|> реакционный объем<|25.00|><|25.00|> расположен не слоями<|26.00|><|26.00|> не горизонтальными слоями<|27.00|><|27.00|> а вертикальными<|28.00|><|28.00|> вы можете видеть<|29.00|><|29.00|> их<|30.00|>,False
866,/workspace/datasets/whisper_prep_dataset/train/created_dataset/dump/4bvskQiMpbE/108440.mp3,-0.046181215380784124,term,"границ нефтяной залежи, строят структурные карты. Отдельным элементом такой карты выступает изогипса от древнегреческого равной и высота. Это линия на карте, состоящая из точек с одинаковой высотой или глубиной над выбранным уровнем. Таким образом, структурные карты представляют собой графическое изображение нефтяной залежи в изогипсах, определяющих положение.","<|0.00|> границ нефтяной залежи, строят структурные карты. Отдельным<|4.48|><|4.48|> элементом такой карты выступает<|7.20|><|7.20|> изогипса, от древнегреческого равной и высота. Это линия на<|12.28|><|12.28|> карте, состоящая из точек с<|14.84|><|14.84|> одинаковой высотой или глубиной над выбранным уровнем. Таким<|19.60|><|19.60|> образом, структурные карты<|21.98|><|21.98|> представляют собой графическое изображение нефтяной залежи<|25.92|><|25.92|> в изогипсах, определяющих положение<|28.32|>",False
362,/workspace/datasets/whisper_prep_dataset/train/created_dataset/dump/EiFc1LMtrsY/2544860.mp3,-0.04627659451216459,term,"содержанию базовых масел, и подгруппы по качеству базовых масел, короче говоря, по индексу вязкости. И три вида по содержанию парафинов. Ну, эти классификации уже, в принципе, особенно технологически используются мало, в основном используется техническая классификация, и любая нефть представляет собой комбинацию нескольких цифр такой.",<|0.00|> содержанию базовых масел и подгруппы по<|2.52|><|2.52|> качеству базовых масел короче говоря по индексу вязкости и<|7.20|><|7.20|> 3 вида по содержанию парафинов<|10.56|><|10.56|> ну эти классификации уже в принципе особенно технологическая<|17.40|><|17.40|> используется мало в основном<|20.04|><|20.04|> используется техническая классификации любая нефть<|22.80|><|22.80|> представляет собой комбинацию нескольких цифр такой<|26.52|>,False
777,/workspace/datasets/whisper_prep_dataset/train/created_dataset/dump/UExih7oWg4E/1659240.mp3,-0.04633670649387308,question,"Первый. Спрос на нефть неуклонно растет. Почти никогда не падает. Был небольшой спад спроса на нефть в 2008 году в кризис. Был спад спроса на нефть в 2020 году в COVID. И более-менее все. А так, вот что вы хотите делать. Миллион баррелей в день в год. Каждый год мир потребляет на 1 миллион баррелей в день больше. С одной стороны,","<|0.00|> Первый спрос на нефть неуклонно растет.<|4.20|><|4.20|> почти никогда не падает.<|6.38|><|6.92|> Был небольшой спад спроса на нефть в 2008 году в кризис,<|13.18|><|13.80|> был спад спроса на нефть в 2020 году в COVID,<|16.96|><|17.30|> и более-менее все.<|18.28|><|19.12|> А так, вот что вы хотите делаете,<|20.94|><|21.08|> миллион баррелей в день в год.<|22.28|><|23.78|> Каждый год мир потребляет на 1 миллион баррелей в день<|26.16|><|26.16|> больше.<|26.74|><|27.26|> С одной стороны.<|28.10|>",False
308,/workspace/datasets/whisper_prep_dataset/train/created_dataset/dump/EiFc1LMtrsY/740140.mp3,-0.046352656868596874,connector,"Иногда сейчас есть тенденция на нефтеперерабатывающих заводах объединения их с нефтехимическими заводами, то есть частично в нефтепереработку приходит нефтехимия. Это связано с тем, что в принципе нефтехимические продукты имеют достаточно высокую добавленную стоимость. Фактически нефтехимия всегда дороже, чем топливо.","<|0.00|> Иногда сейчас вот есть тенденция на нефтеперерабатывающих<|5.36|><|5.36|> заводах объединения их с нефтехимическими заводами.<|10.58|><|10.72|> То есть частично в нефтепереработку приходит нефтехимия.<|13.76|><|13.76|> Это связано с тем, что в принципе нефтехимические продукты<|18.20|><|18.20|> имеют достаточно высокую добавленную стоимость.<|22.36|><|22.68|> Фактически нефтехимия всегда дороже, чем топливо.<|26.52|>",False
999,/workspace/datasets/whisper_prep_dataset/train/created_dataset/dump/YSKJxaTai8o/3429960.mp3,-0.04640822857618332,question,"Почему? Потому что нужно настраивать автоматические групповые замерные установки. Нужно привлекать специализированные сервисные компании для ежегодного или полугодового индивидуального замера скважин. То есть, когда по замерам скважин, что мы имеем в виду? Это сколько жидкости, нефти, воды, газа. Допустим, можно, если скважины высокодебетные или открытые,","<|0.00|> То есть почему? Потому что нужно настраивать автоматические<|4.88|><|4.88|> групповые замерные установки, нужно привлекать специализированные<|10.00|><|10.00|> сервисные компании для ежегодного или полугодового индивидуального<|14.94|><|14.94|> замера скважин.<|16.48|><|18.34|> То есть когда по замерам скважин, что мы имеем в виду? Это<|20.88|><|20.88|> сколько жидкости, нефти, воды, газа.<|22.98|><|25.26|> Допустим, можно, если скважины высокодебитные или отрабатывают<|29.72|>",False
381,/workspace/datasets/whisper_prep_dataset/train/created_dataset/dump/EiFc1LMtrsY/3091900.mp3,-0.04642761897412129,term,"канцерогенов получать в атмосфере, поэтому бензин очень строго контролируется. Ну и ароматические углеводороды тоже. Это, кстати, некая проблема была определенная для нефтепереработки, потому что октановое число ароматических углеводородов достаточно велико. И ограничение их содержания заставляет замещать их чем-то другим. Определенные есть здесь нормы по",<|1.58|> экологенов получать в атмосфере поэтому бензин очень строго<|5.90|><|5.90|> контролируется<|6.60|><|6.82|> ну и ароматические углеводороды тоже это кстати некая<|9.94|><|9.94|> проблема была<|10.92|><|11.52|> определенная для нефтепереработки потому что октановое число<|14.42|><|15.14|> ароматических углеводородов достаточно велико и<|17.46|><|19.14|> ограничение содержания здесь заставляет замещать их чем-то<|22.88|><|22.88|> другим<|23.20|><|25.52|> определенные есть<|27.52|><|27.52|> здесь нормы по<|29.52|>,False
839,/workspace/datasets/whisper_prep_dataset/train/created_dataset/dump/UExih7oWg4E/3408570.mp3,-0.04650175759355382,connector,"Будет построено очень много мощностей производства СПГ. В основном в США. Прогнозируется, что утилизация этих мощностей будет 60-70%. Это фактически означает, что можно будет купить газ по американской цене и сжижить его, грубо говоря, по себестоимости. Это означает две вещи. Во-первых, в Европе газ, наверное, подешевеет, а вот в Америке подорожает. Потому что если сейчас нельзя купить с","<|0.00|> построено очень много мощностей производства СПГ, в основном<|4.08|><|4.08|> США.<|4.44|><|6.60|> Дорогнозируется, что утилизация этих мощностей будет 60-70%.<|10.12|><|10.12|> Это фактически означает, что можно будет купить газ по<|13.16|><|13.16|> американской цене и сжижить его, грубо говоря, по себестоимости.<|17.20|><|18.84|> Это означает две вещи, что, во-первых, в Европе газ,<|20.36|><|20.36|> наверное, подешевеет, а вот в Америке подорожает.<|23.68|><|24.72|> Потому что, если сейчас нельзя купить сколько хочешь газа<|29.60|>",False
646,/workspace/datasets/whisper_prep_dataset/train/created_dataset/dump/t0ov4FfyNR0/1940050.mp3,-0.04658440617107165,connector,"как добывать нефть, прокалываем этот пакетик с нефтью, она течет, это первая стадия, потом мы добавляем воду, это вторая стадия, и вот в среднем с помощью вот этих двух стадий мы можем добыть не более 50%. А вообще, допустим, средний коэффициент извлечения нефти в России он где-то там 35-40%. О чем это говорит? Это говорит о том, что на этих нефтяных месторождениях, которые уже вложены миллиарды рублей, построены","<|0.00|> как добывать нефть, да, там, прокалываем этот пакетик с нефтью,<|4.32|><|4.32|> она течет, это первая стадия.<|6.04|><|6.80|> Потом мы добавляем воду, это вторая стадия.<|9.40|><|9.40|> И вот как бы в среднем с помощью вот этих двух стадий мы<|13.56|><|13.56|> можем добыть не более 50%.<|16.36|><|16.36|> А вообще, вот, допустим, средний коэффициент извлечения нефти<|19.88|><|19.88|> в России, он где-то там 35-40%.<|22.44|><|22.44|> О чем это говорит?<|23.12|><|23.84|> Это говорит о том, что вот на этих нефтяных месторождениях,<|26.00|><|26.00|> которые уже вложены там миллиарды рублей, построены скважины,<|29.22|>",False
443,/workspace/datasets/whisper_prep_dataset/train/created_dataset/dump/EiFc1LMtrsY/4935660.mp3,-0.046628225496253714,term,"например, про гидроочистку, там происходит каталитическое удаление серностых соединений прежде всего. Если говорить про изомеризацию, там происходит изменение группового состава продуктов. Нормальные алканы там превращаются в изоалканы. В каталитическом реформинге нафтеновые углеводороды превращаются в ароматические. Все это под действием катализаторов. Другой тип процессов это каталитический крекинг и гидрокрекинг, где происходит разрыв тяжелых углеводородов на более легкие. Это мы все будем",<|0.00|> например про гидроочистку<|1.00|><|1.00|> там происходит<|2.00|><|2.00|> там происходит<|3.00|><|3.00|> каталитическое удаление сернистых<|4.00|><|4.00|> соединений<|5.00|><|5.00|> прежде всего<|6.00|><|6.00|> если говорить<|9.00|><|9.00|> про изомеризацию<|10.00|><|10.00|> там происходит изменение<|11.00|><|11.00|> группового состава<|12.00|><|12.00|> продуктов<|13.00|><|13.00|> нормальные алканы<|14.00|><|14.00|> там превращаются<|15.00|><|15.00|> в изоалканы<|16.00|><|16.00|> в каталитическом реформинге<|17.00|><|17.00|> нафтеновые углеводороды<|18.00|><|18.00|> превращаются<|19.00|><|19.00|> в ароматические<|20.00|><|20.00|> все это под действием<|21.00|><|21.00|> катализаторов<|22.00|><|22.00|> другой тип процессов<|23.00|><|23.00|> это каталитический<|24.00|><|24.00|> пекинг<|25.00|><|25.00|> где происходит<|26.00|><|26.00|> разрыв<|27.00|><|27.00|> тяжелых углеводородов<|28.00|><|28.00|> на более легкие<|29.00|><|29.00|> это мы все будем<|30.00|>,False
637,/workspace/datasets/whisper_prep_dataset/train/created_dataset/dump/t0ov4FfyNR0/1689580.mp3,-0.046708987831758954,question,"много процедур всяких произвести. Там много всяких может быть осложнений. Нужно отделить от газа, от механических примесей, от воды. И вот только потом эта нефть уже поступает в систему транснефти, в трубопроводную систему, где она транспортируется до нужных там нефтеперерабатывающих заводов, либо на экспорт за пределы нашей страны. Можно это делать автоцистернами, можно там ЖД-цистернами. То есть, в принципе, путей много, но вот перед тем, как куда-то ее везти, надо с ней очень много процедур произвести.","<|0.00|> процедур всяких произвести, там много всяких может быть осложнений.<|3.74|><|3.84|> Нужно отделить от газа, от механических примесей, от воды,<|7.76|><|7.76|> и вот только потом эта нефть уже поступает в систему транснефти,<|12.26|><|12.26|> в трубопроводную систему, где она транспортируется до нужных<|15.32|><|15.32|> там нефтеперерабатывающих заводов, либо на экспорт, да, за<|18.72|><|18.72|> пределы нашей страны.<|19.90|><|20.58|> Можно это делать автоцистернами, можно там ЖД-цистернами,<|23.76|><|23.76|> то есть в принципе путей много, но вот перед тем, как куда-то<|26.88|><|26.88|> ее везти, надо с ней очень много процедур произвести.<|29.88|>",False
