index,audio,avg_prob,type,text,text_ts,human_verified
280,/workspace/datasets/whisper_prep_dataset/train/created_dataset/dump/DXiVdLBVkIo/174830.mp3,-0.05523623633780517,term,"а в другом развит упруговодонапорный режим, то разработка каждого из них требует различных схем расположения скважин и технологий извлечения нефти и газа. Итак, подведем итоги вышесказанного. В пределах месторождения, на основании учета геолого-физических свойств пород коллекторов, физико-химических свойств нефти, воды и газа, фазовав состояние углеводородов, выбирается объект.","<|0.00|> шапка,<|0.48|><|0.84|> а в другом развит упруговодонапорный режим,<|3.36|><|3.80|> то разработка каждого из них требует различных схем расположения<|7.68|><|7.68|> скважин<|8.16|><|8.16|> и технологии извлечения нефти и газа.<|10.88|><|11.40|> Итак, подведем итоги вышесказанного.<|13.80|><|14.24|> В пределах месторождения,<|15.72|><|15.96|> на основании учета геолого-физических свойств пород коллекторов,<|19.76|><|20.24|> физико-химических свойств нефти, воды и газа,<|23.08|><|23.68|> фазового состояния углеводородов выбирается объект,<|27.44|>",False
69,/workspace/datasets/whisper_prep_dataset/train/created_dataset/dump/xbrsbYaj-gU/1095080.mp3,-0.055304730569736824,term,"давлению и напору контурных вод. Пласты испытывают горное давление. Это вес вышележащих горных пород. Над залежью нефти может залегать газовая шапка, оказывающая давление на залежь. Внутри залежа действуют силы упругости нефти, газа, воды и породы пласта. Системой разработки месторождения следует называть совокупность","<|0.00|> давлению и напору контурных вод.<|1.86|><|3.14|> Пласты испытывают горное давление – это вес вышележащих, да,<|7.70|><|7.70|> горных пород.<|8.62|><|8.98|> Над залежью нефти может залегать газовая шапка, оказывающая<|12.48|><|12.48|> давление на залежи.<|13.68|><|14.18|> Внутри залежа действуют силы упругости нефти, газа, воды и<|18.76|><|18.76|> породы пласта.<|20.04|><|21.64|> Так вот, системой разработки месторождения следует называть<|26.24|><|26.24|> совокупность<|27.12|>",False
683,/workspace/datasets/whisper_prep_dataset/train/created_dataset/dump/t0ov4FfyNR0/3091940.mp3,-0.05543746446346631,connector,"под землей, там это произойдение не может, потому что там нет кислорода. А что здесь происходит? У нас получается разогретый газ поднимается на поверхность, встречается с воздухом, в воздухе есть кислород, и он начинает гореть. Вот так вот просто с химической точки зрения можно это объяснить. Короткосрочно я могу себе представить, а вот в течение долгих лет настолько много там газа получается? На самом деле, смотрите, газ находится под землей, очень высокое давление. допустим,","<|0.00|> под землей,<|1.74|><|2.42|> там это произойти не может,<|3.78|><|3.84|> потому что там нет кислорода.<|4.70|><|5.20|> А что здесь происходит?<|6.02|><|6.10|> У нас получается,<|6.74|><|6.86|> разогретый газ<|7.54|><|7.54|> поднимается на поверхность,<|8.62|><|9.54|> встречается с воздухом,<|10.84|><|10.90|> в воздухе есть кислород,<|11.78|><|11.86|> и он начинает гореть.<|12.90|><|13.90|> То есть вот так вот,<|14.56|><|14.76|> как бы просто<|15.28|><|15.28|> с химической точки зрения<|16.62|><|16.62|> можно это объяснить.<|17.52|><|18.02|> Не,<|18.14|><|18.20|> ну,<|18.30|><|18.38|> короткосрочно,<|19.24|><|19.40|> я могу себе это представить,<|20.62|><|20.66|> а вот в течение долгих лет<|21.86|><|21.86|> это настолько много там газа получается?<|23.48|><|23.76|> Ну,<|24.02|><|24.16|> на самом деле,<|24.78|><|25.38|> смотрите,<|25.74|><|25.90|> газ находится под землей,<|27.44|><|27.94|> очень высокое давление.<|29.00|><|29.58|> Допустим,<|29.96|>",False
732,/workspace/datasets/whisper_prep_dataset/train/created_dataset/dump/UExih7oWg4E/373240.mp3,-0.05549620298188529,term,"соревнующимся с Россией были Соединенные Штаты. Опять же, 1920 год – это месторождение Спиндлтоп, скважина, которая дала какие-то огромные совершенно дебиты нефти, фонтаны и так далее. 1938 год – это открытие нефти в Саудской Аравии. Вообще, если посмотреть, какая страна за свою историю вынула и продала на мировой рынок больше всего нефти, это Соединенные Штаты.","<|0.00|> мира, соревнующимся с Россией, были Соединенные Штаты.<|3.28|><|3.84|> Опять же, 1920 год – это месторождение Спиндлтоп, скважина,<|8.94|><|8.94|> которая дала там какие-то огромные совершенно дебиты нефти,<|13.88|><|13.88|> фонтаны и так далее.<|15.90|><|15.90|> 1938 год – это открытие нефти в Саудской Аравии.<|19.34|><|19.94|> Вообще, если посмотреть, какая страна за свою историю вынула<|23.48|><|23.48|> и продала на мировой рынок больше всего нефти, это Соединенные<|27.36|>",False
253,/workspace/datasets/whisper_prep_dataset/train/created_dataset/dump/C8QuQzgiBmY/3384200.mp3,-0.05551988332184313,question,"не обязательно, чтобы там все эти элементы всегда присутствовали. Как еще можно хранить нефть, помимо нефтебаз? Это подземные хранилища. Ну, собственно, удобство подземных хранилищ заключается в том, что территории они не занимают, меньше пожаров-зрывоопасность, меньше капиталов вложения, ну, при прочих равных условиях. Собственно, какие варианты возможны? Есть варианты, когда их делают","<|0.00|> необязательно,<|0.44|><|0.64|> чтобы там<|0.96|><|0.96|> все эти<|1.36|><|1.36|> элементы<|1.76|><|1.76|> всегда<|2.08|><|2.08|> присутствовали.<|2.90|><|5.32|> Как еще<|5.90|><|5.90|> можно хранить<|6.62|><|6.62|> нефть,<|6.92|><|7.02|> помимо<|7.32|><|7.32|> нефтебаз?<|7.90|><|8.50|> Это<|8.92|><|8.92|> подземные<|9.50|><|9.50|> хранилища.<|10.22|><|10.46|> Ну,<|10.56|><|10.68|> собственно,<|10.94|><|11.10|> удобство<|11.48|><|11.48|> подземных<|11.98|><|11.98|> хранилищ<|12.62|><|12.62|> заключается<|14.00|><|14.00|> в том,<|15.04|><|15.14|> что<|15.52|><|15.52|> территории<|17.12|><|17.12|> они не<|17.52|><|17.52|> занимают,<|18.16|><|18.62|> меньше пожаровзрывоопасность,<|20.30|><|20.46|> меньше капиталов<|21.18|><|21.18|> вложения,<|21.68|><|21.96|> ну,<|22.12|><|22.14|> при прочих<|22.56|><|22.56|> равных условиях.<|23.28|><|24.96|> Собственно,<|25.30|><|25.86|> какие варианты<|26.60|><|26.60|> возможны?<|27.30|><|27.46|> Есть варианты,<|28.30|><|28.38|> когда их делают<|29.34|>",False
300,/workspace/datasets/whisper_prep_dataset/train/created_dataset/dump/EiFc1LMtrsY/514570.mp3,-0.05556358020597448,connector,"в широком состоянии содержится в нефти, это, естественно, пентаны с температурой кипения примерно 35. Соответственно, бензиновая фракция – это самая легкая жидкая фракция в нефти. Она укипает от 35 до 200 градусов. Интервалы температур кипения, начало и конца, они немножко плавают туда-сюда, в зависимости от того, какой именно нефтепродукт надо получить, с какими характеристиками. Обычно это так. Далее, керосиновая фракция – это средняя фракция с температурой","<|0.00|> содержатся в нефти, это, естественно, пентаны с температурой<|4.24|><|4.24|> кипения примерно 35.<|6.48|><|6.60|> Соответственно, бензиновая фракция – это самая легкая жидкая<|9.16|><|9.16|> фракция в нефти.<|10.00|><|10.48|> Она укипает от 35 до 200 градусов.<|13.48|><|13.60|> Ну, интервал температур кипения, начало и конца, они<|16.58|><|16.58|> немножко плавают туда-сюда, в зависимости от того, какой<|19.88|><|19.88|> именно нефтепродукт надо получить, с какими характеристиками.<|23.60|><|23.72|> Ну, обычно это так.<|25.08|><|25.76|> Далее, керосиновая фракция – это средняя фракция с температурой<|28.60|>",False
526,/workspace/datasets/whisper_prep_dataset/train/created_dataset/dump/X2l-vaKoIBE/1314700.mp3,-0.05561040542088449,connector,"на то, чтобы что-то рассчитать, и результаты, которые мы получаем, оказываются не в пользу моделей слишком детальных. Поэтому происходит оффскелинг, как показано на слайде снизу. И таким образом геологическая модель переводится в состояние гидродинамической модели, на которой отрабатывается размещение сеток скважин, отрабатываются способы заводнения и моделируются различные варианты разработки пласта в целом.","<|0.00|> то, чтобы что-то рассчитать,<|2.10|><|2.32|> и результаты, которые мы получаем, оказываются не в пользу<|6.08|><|6.08|> моделей слишком детальных.<|8.18|><|8.82|> Поэтому происходит обскейлинг, как показано на слайде снизу.<|13.94|><|14.80|> И таким образом геологическая модель переводится в состояние<|17.48|><|17.48|> гидродинамической модели,<|19.30|><|19.38|> на которой отрабатывается размещение сеток скважин,<|22.60|><|24.10|> отрабатываются способы заводнения и моделируются различные<|27.86|><|27.86|> варианты разработки полоста в целом.<|29.80|>",False
29,/workspace/datasets/whisper_prep_dataset/train/created_dataset/dump/WfcldGf1Xoc/583480.mp3,-0.05565627641044557,noise,"Сопоставление карта вводненности и карты за бар позволяет судить о продвижении контуров нефтеносности. Спасибо за внимание. Ставьте лайки, подписывайтесь на канал. Также, если вы хотите выбрать интересующую тему или наше неточности в излагаемом материале, пишите в группе социальной сети ВКонтакте.","<|0.00|> Сопоставление карты обводненности и карты изобар позволяет<|3.84|><|3.84|> судить о продвижении контуров нефтяносности.<|7.10|><|8.14|> Спасибо за внимание!<|9.42|><|9.80|> Ставьте лайки, подписывайтесь на канал.<|12.20|><|12.64|> Также, если вы хотите выбрать интересующую тему или наше неточности<|16.84|><|16.84|> в излагаемом материале, пишите в группе социальной сети ВКонтакте.<|21.60|><|22.00|> Редактор субтитров А.Семкин Корректор А.Егорова<|22.42|>",False
742,/workspace/datasets/whisper_prep_dataset/train/created_dataset/dump/UExih7oWg4E/655400.mp3,-0.055679996963590384,connector,"российское, не советское сельское хозяйство и так далее. Но это, тем не менее, было вот так. Почему рухнул Советский Союз? От того ли, что саудовцы сговорились с США и обрушили цены, ну, это тоже не так. Опять-таки, в силу того, что советская экономика была в достаточном мере автортична, она от нефтяной выручки зависела в гораздо меньшей мере, чем даже нынешняя российская.","<|0.00|> чем российское сельское хозяйство и так далее.<|3.30|><|3.90|> Но это, тем не менее, было вот так.<|5.84|><|6.36|> Почему рухнул Советский Союз?<|8.10|><|8.54|> От того ли, что саудовцы сговорились с США и обрушили цены?<|14.92|><|15.58|> Ну, это тоже не так.<|16.66|><|17.46|> Опять-таки, в силу того, что советская экономика была в достаточной<|21.24|><|21.24|> мере автортична,<|22.58|><|23.38|> она от нефтяной выручки зависела в гораздо меньшей мере,<|25.82|><|25.82|> чем даже нынешняя российская.<|27.88|>",False
306,/workspace/datasets/whisper_prep_dataset/train/created_dataset/dump/EiFc1LMtrsY/683700.mp3,-0.055716133199166504,term,"будете видеть часто в курсе лекции, потому что это базовая для нас картинка. Кратко опишу. У нас нефть подвергается разделению на фракции по температурам кипения. Далее бензиновая фракция поступает на ряд, целый ряд процессов производства компонентов бензина. Керосин и дизельное топливо в основном подвергаются гидроочистке, удалению серы из них. Мазут поступает на вакуумную перегонку, производительность","<|0.00|> будете видеть часто в курсе лекции, потому что это базовая<|3.00|><|3.00|> для нас картинка.<|3.92|><|4.72|> Кратко опишу.<|5.76|><|6.72|> У нас нефть подвергается разделению на фракции по температурам<|10.00|><|10.00|> кипения.<|11.00|><|11.80|> Далее бензиновая фракция поступает на ряд, целый ряд<|16.12|><|16.12|> процессов производства компонентов бензина.<|20.98|><|21.84|> Керосин и дизельное топливо в основном подвергаются гидроочистке,<|24.62|><|24.62|> удалению серы из них.<|26.04|><|26.70|> Мазут поступает на вакуумную перегонку.<|29.04|>",False
1091,/workspace/datasets/whisper_prep_dataset/train/created_dataset/dump/xhaoJXvEuRk/224390.mp3,-0.055810422503522465,connector,насосных станций до установки предварительного сброса воды. Часто этот участок бывает совмещенным с одновременным отделением газа первой ступени сепарации. Затем вода проходит до очистку до нужного качества. На участке шестого элемента отделившаяся вода необходимого качества и количества из емкости установки предварительного сброса воды отстойной аппараты,<|0.00|> станций до установки предварительного сброса воды.<|4.24|><|5.04|> Часто этот участок бывает совмещенным с одновременным отделением<|9.20|><|9.20|> газа первой ступени сепарации.<|11.40|><|12.20|> Затем вода проходит до очистки до нужного качества.<|15.76|><|16.76|> На участке шестого элемента отделившаяся вода необходимого<|20.28|><|20.28|> качества и количества<|22.08|><|22.08|> из емкостей установки предварительного сброса воды от стойной<|26.48|><|26.48|> аппараты<|27.28|>,False
806,/workspace/datasets/whisper_prep_dataset/train/created_dataset/dump/UExih7oWg4E/2473100.mp3,-0.05583059805758239,connector,"Будет ли это мопед, мотоцикл с коляской или условно то, что называется golf car, нечто с мотором мощностью 40 киловатт, с батареей, которая хватает на 100 километров пробега. То есть довольно убогие электромобили вообще-то. Но по сравнению с велосипедом скачок вперед. И если они будут сдвигаться туда, в общем, да, действительно, прогнозы спроса на","<|0.00|> Будет ли это мопед, мотоцикл с коляской или там условно то,<|3.76|><|3.76|> что называется golf car, да, там, так сказать, нечто с мотором<|9.04|><|9.04|> мощностью 40 киловатт, с батареей, которая хватает на 100<|13.00|><|13.00|> километров пробега.<|14.14|><|14.14|> То есть довольно убогие электромобили вообще-то, но по сравнению<|18.70|><|18.70|> с велосипедом скачок вперед.<|20.92|><|21.62|> И если они будут сдвигаться туда, в общем, да,<|24.24|><|24.24|> действительно, прогнозы спроса на нефть, ну, они будут<|28.36|>",False
773,/workspace/datasets/whisper_prep_dataset/train/created_dataset/dump/UExih7oWg4E/1544800.mp3,-0.05584088112768119,term,"по нескольким причинам. Советский Союз, которому резко не хватало денег, крайне, он стал выжимать из советской нефтянки все соки. То есть, по классике, коровку не кормить, а доить ее вдвое сильнее. Нефтянки категорически не давали денег, но говорили, выжимайте все. Барварская разработка месторождения, разубоживание запасов. Это все привело к тому, что на фоне недоинвестиций и переэксплуатации добыча упала,","<|0.00|> По нескольким причинам.<|1.02|><|1.10|> Советский Союз, которому резко не хватало денег, крайне,<|4.12|><|4.28|> он стал выжимать из советской нефтянки все соки.<|7.34|><|7.74|> То есть, по классике, коровку не кормить,<|10.90|><|11.70|> а доить ее вдвое сильнее.<|13.40|><|14.24|> Нефтянки категорически не давали денег,<|16.44|><|16.54|> но говорили, выжимайте все.<|17.66|><|18.24|> Барварская разработка месторождений,<|20.32|><|20.44|> разубоживание запасов.<|21.68|><|21.84|> Вот это все привело к тому, что на фоне недоинвестиций<|24.96|><|24.96|> и переэксплуатации добыча упала.<|27.46|>",False
904,/workspace/datasets/whisper_prep_dataset/train/created_dataset/dump/YSKJxaTai8o/784280.mp3,-0.05584110801906458,question,"какие средства необходимы для достижения цели. И в этом плане описывается цель, чего мы должны достичь, где описываются и KPI, то есть минимальных KPI должны достичь. Теперь перейдем именно непосредственно мировым практикам. Я сейчас немножко добавлю. Насчет Shell, то, что озвучили, 90 у них предприятий, это как будто весь Казахстан. Это можно сказать, как Казахстан","<|0.00|> какие средства необходимы для достижения цели.<|2.82|><|2.82|> И в этом плане описывается цель, чего мы должны достичь,<|7.72|><|7.72|> где описывается и KPI, то есть, минимальных KPI должны достичь.<|13.60|><|14.04|> Теперь перейдем именно непосредственно к мировым практикам.<|19.48|><|19.66|> Я сейчас немножко добавлю, да, насчет Shell, вот то, что озвучили,<|23.56|><|23.56|> 90 у них предприятий, это как будто весь Казахстан, да?<|26.82|><|26.82|> Это можно сказать как Казахстан.<|28.26|>",False
