index,audio,avg_prob,type,text,text_ts,human_verified
1095,/workspace/datasets/whisper_prep_dataset/train/created_dataset/dump/xhaoJXvEuRk/338380.mp3,-0.008308011681285941,noise,"поступая к дожимным насосным станциям. Нефтяной газ отбирается в газосборную сеть, а жидкая фаза направляется к установке комплексной подготовки нефти. Водная фаза движется к установке предварительного сброса воды. Очищенная вода подается на кустовую насосную станцию с целью нагнетания в пласт. Спасибо за внимание! Ставьте лайки, подписывайтесь на канал. Также, если хотите выбрать интересующую тему","<|0.00|> поступая к дожимным насосным станциям.<|2.64|><|3.18|> Нефтяной газ отбирается в газосборную сеть,<|5.96|><|6.38|> а жидкая фаза направляется к установке комплексной подготовки<|9.74|><|9.74|> нефти.<|10.36|><|11.08|> Водная фаза движется к установке предварительного сброса<|14.24|><|14.24|> воды.<|14.92|><|15.30|> Очищенная вода подается на кустовую насосную станцию с целью<|19.46|><|19.46|> нагнетания в пласт.<|21.14|><|21.80|> Спасибо за внимание!<|23.30|><|23.82|> Ставьте лайки, подписывайтесь на канал.<|26.30|><|26.84|> Также, если хотите выбрать интересующую тему<|29.62|>",False
36,/workspace/datasets/whisper_prep_dataset/train/created_dataset/dump/xbrsbYaj-gU/167940.mp3,-0.010133986092922796,noise,"Объекты разработки подразделяют на самостоятельные и возвратные. Возвратные объекты, в отличие от самостоятельных, предполагается разрабатывать скважины, эксплуатирующими в первую очередь какой-то другой объект. Если мы говорим о сетке размещения скважин, то мы говорим о характере взаимного расположения добывающих и нагнетательных скважин на эксплуатационном объекте с указанием расстояния между ними.","<|0.00|> И вот объекты разработки подразделяют на самостоятельные и<|3.40|><|3.40|> возвратные.<|4.56|><|5.12|> Возвратные объекты, в отличие от самостоятельных, предполагается<|8.52|><|8.52|> разрабатывать скважинами, эксплуатирующими в первую очередь<|11.60|><|11.60|> какой-то другой объект.<|13.32|><|15.94|> Если мы говорим о сетке размещения скважин, то мы говорим о<|18.12|><|18.12|> характере взаимного расположения добывающих и нагнетательных<|23.60|><|23.60|> скважин на эксплуатационном объекте с указанием расстояния<|28.40|><|28.40|> между ними.<|29.98|>",False
121,/workspace/datasets/whisper_prep_dataset/train/created_dataset/dump/bXuoSlgKMs8/56860.mp3,-0.010965330116505356,term,"пластовой энергии с целью максимального извлечения нефти и газа из недр. О режимах судят по изменению во времени дебитов, пластовых давлений, газовых факторов, продвижению краевых вод. Естественные режимы работы пластов классифицируют на водонапорный, упругий, режим газовой шапки, режим растворенного газа и гравитационный, а характеризуем каждый из них подробнее.","<|0.00|> пластовой энергии с целью максимального извлечения нефти и<|3.88|><|3.88|> газа из недр.<|5.06|><|5.06|> О режимах судят по изменению во времени дебитов, пластовых<|9.40|><|9.40|> давлений, газовых факторов, продвижению краевых вод.<|13.92|><|14.94|> Естественные режимы работы пластов классифицируют на водонапорный,<|19.88|><|19.88|> упругий, режим газовой шапки, режим растворенного газа и гравитационный.<|25.62|><|26.16|> Охарактеризуем каждый из них подробнее.<|28.66|>",False
855,/workspace/datasets/whisper_prep_dataset/train/created_dataset/dump/TyJ9baht8kA/117500.mp3,-0.011665854370221496,term,"Последовательная замена жидкости с большей плотностью на жидкость с меньшей плотностью осуществляется промывкой скважины, обычно по схеме, представленной на слайде. После перфорации эксплуатационной колонны в скважину до фильтра опускают насосно-компрессорные трубы. Затем в кольцевое пространство между эксплуатационной колонной и спущенными трубами нагнетают воду.","<|0.00|> Последовательная замена жидкости с большей плотностью на жидкость<|4.20|><|4.20|> с меньшей плотностью осуществляется промывкой скважины,<|8.14|><|8.14|> обычно по схеме, представленной на слайде.<|11.00|><|11.86|> После перфорации эксплуатационной колонны в скважину до<|15.12|><|15.12|> фильтра опускают насосно-компрессорные трубы.<|18.94|><|19.60|> Затем в кольцевое пространство между эксплуатационной колонной<|23.64|><|23.64|> и спущенными трубами нагнетают воду.<|26.66|>",False
274,/workspace/datasets/whisper_prep_dataset/train/created_dataset/dump/DXiVdLBVkIo/0.mp3,-0.011826622722946923,term,"Добрый день! С вами канал Нефть и Газ. В данном видеоролике делюсь своим личным мнением. Изложение материала может быть упрощено и содержать неточности. Из этого видеоролика вы узнаете об объектах разработки нефтяных месторождений, условиях их выделения и видах. Основной целью разработки является извлечение промышленных запасов углеводородов в установленные сроки при минимуме материальных затрат","<|0.12|> Добрый день! С вами канал Нефть и Газ.<|3.48|><|3.84|> В данном видеоролике делюсь своим личным мнением.<|6.80|><|7.18|> Изложение материала может быть упрощено и содержать неточности.<|11.40|><|12.24|> Из этого видеоролика вы узнаете об объектах разработки нефтяных<|16.12|><|16.12|> месторождений,<|17.40|><|17.78|> условиях их выделения и видах.<|20.00|><|20.68|> Основной целью разработки является извлечение промышленных<|24.50|><|24.50|> запасов углеводородов<|25.94|><|25.94|> в установленные сроки при минимуме материальных затрат<|29.48|>",False
0,/workspace/datasets/whisper_prep_dataset/train/created_dataset/dump/fhg9L-03uH0/0.mp3,-0.012742183643341478,connector,"Добрый день! С вами канал Нефть и Газ. В данном видеоролике делюсь своим личным мнением. Изложение материала может быть упрощено и содержать неточности. Из этого видеоролика вы узнаете о методах подсчета запасов нефти и газа, поймете, что называют коэффициентом извлечения нефти. Для подсчета запасов нефти используют следующие методы. Объемный, статистический и метод материального баланса.","<|0.28|> Добрый день! С вами канал Нефть и Газ.<|3.58|><|3.94|> В данном видеоролике делюсь своим личным мнением.<|6.90|><|7.30|> Изложение материала может быть упрощено и содержать неточности.<|11.52|><|12.42|> Из этого видеоролика вы узнаете о методах подсчета запасов<|16.02|><|16.02|> нефти и газа,<|17.20|><|17.54|> поймете, что называют коэффициентом извлечения нефти.<|20.66|><|21.38|> Для подсчета запасов нефти используются следующие методы.<|24.96|><|25.20|> Объемный, статистический и метод материального баланса.<|29.96|>",False
853,/workspace/datasets/whisper_prep_dataset/train/created_dataset/dump/TyJ9baht8kA/59040.mp3,-0.01340509601868689,term,"Таким образом, сущность освоения скважины заключается в создании депрессии или перепады между пластовым и забойным давлениями. Пластовым называют давление, под которым находится жидкость и газ, насыщающий поры или трещины пород коллекторов. Давление на забое, то есть дне скважины, именуют забойным. Оно характеризует энергию пласта, обусловливающую подъем жидкости или газа в стволе скважины.","<|0.00|> Таким образом, сущность освоения скважины заключается в<|4.24|><|4.24|> создании депрессии или перепады между пластовым и забойным<|8.54|><|8.54|> давлениями.<|9.82|><|10.40|> Пластовым называют давление, под которым находится жидкость<|14.06|><|14.06|> и газ, насыщающий поры или трещины пород коллекторов.<|18.04|><|18.74|> Давление на забое, то есть дне скважины, именуют забойным.<|22.84|><|23.34|> Оно характеризует энергию пласта, обусловливающую подъем жидкости<|27.44|><|27.44|> или газа в стволе скважины.<|29.64|>",False
854,/workspace/datasets/whisper_prep_dataset/train/created_dataset/dump/TyJ9baht8kA/88680.mp3,-0.013610455947595515,term,"Для эффективного освоения скважины необходимо, чтобы плотовое давление превышало забойное. Достигается это либо уменьшением плотности, либо снижением уровня столба жидкости в скважине. Для снижения уровня жидкости в скважине используют свобирование, аэрацию, откачку жидкости штанговыми скважинными насосами или погружными центробежными электронасосами.","<|0.72|> Для эффективного освоения скважины необходимо, чтобы пластовое<|4.78|><|4.78|> давление превышало забойное.<|6.92|><|8.02|> Достигается это либо уменьшением плотности, либо снижением<|12.18|><|12.18|> уровня столба жидкости в скважине.<|14.82|><|14.82|> Для снижения уровня жидкости в скважине используют свобирование,<|20.16|><|20.16|> аэрацию, откачку жидкости штанговыми скважинными насосами<|24.46|><|24.46|> или погружными центробежными электронасосами.<|27.82|>",False
867,/workspace/datasets/whisper_prep_dataset/train/created_dataset/dump/4bvskQiMpbE/136760.mp3,-0.01381795629276894,term,"кровли или подошвы относительно опорной плоскости. Глубина или высота любой точки кровли или подошвы пласта от уровня моря есть абсолютная отметка кровли и подошвы в данной точке. Построение структурной карты заключается в проведении изогипс для кровли или подошвы пласта. Структурные карты – основной документ при прогнозе нефтегазоносности, оценке ресурсов и запасов","<|0.00|> кровли или подошвы относительно опорной плоскости. Глубина<|4.42|><|4.42|> или высота любой точки кровли или<|6.82|><|6.82|> подошвы пласта от уровня моря есть абсолютная отметка кровли<|11.12|><|11.12|> и подошвы в данной точке.<|12.82|><|13.88|> Построение структурной карты заключается в проведении изогипс<|18.20|><|18.20|> для кровли или подошвы пласта.<|20.26|><|20.92|> Структурные карты – основной документ при прогнозе нефтегазоносности,<|25.48|><|25.48|> оценке ресурсов и запасов<|27.72|>",False
269,/workspace/datasets/whisper_prep_dataset/train/created_dataset/dump/hRSLef3cN90/0.mp3,-0.014411187506630086,term,"Добрый день! С вами канал Нефть и Газ. В данном видеоролике делюсь своим личным мнением. Изложение материала может быть упрощено и содержать неточности. Сегодня мы обсудим коллекторские свойства продуктивного пласта. В пластовых условиях нефть и газ обычно заполняют пустоты, поры в горных породах. Породы, содержащие нефть, газ, воду, называются коллекторами.","<|0.24|> Добрый день! С вами канал Нефть и Газ. В данном видеоролике<|4.96|><|4.96|> делюсь своим личным мнением.<|6.88|><|7.26|> Изложение материала может быть упрощено и содержать неточности.<|11.48|><|12.06|> Сегодня мы обсудим коллекторские свойства продуктивного пласта.<|15.92|><|16.66|> В пластовых условиях нефть и газ обычно заполняют пустоты,<|20.24|><|20.24|> поры в горных породах.<|22.16|><|22.62|> Породы, содержащие нефть, газ, воду, называются коллекторами.<|26.84|>",False
128,/workspace/datasets/whisper_prep_dataset/train/created_dataset/dump/bXuoSlgKMs8/257940.mp3,-0.014413974092762643,term,"при сохранении дебита. Во всех случаях газовый фактор должен оставаться постоянным. По сравнению с водонапорным, упругий режим работы пласта менее эффективен. Режим газовой шапки проявляется в таких геологических условиях, при которых источником пластовой энергии является упругость газа, сосредоточенного в газовой шапке. Для этого необходимо, чтобы залежь была изолирована по периферии.","<|0.00|> сохранении дебита.<|1.36|><|2.04|> Во всех случаях газовый фактор должен оставаться постоянным.<|5.84|><|5.84|> По сравнению с водонапорным, упругий режим работы пласта<|10.08|><|10.08|> менее эффективен.<|11.50|><|12.40|> Режим газовой шапки проявляется в таких геологических условиях,<|16.84|><|17.18|> при которых источником пластовой энергии является упругость<|21.42|><|21.42|> газа, сосредоточенного в газовой шапке.<|23.90|><|24.34|> Для этого необходимо, чтобы залежь была изолирована по периферии<|28.42|>",False
118,/workspace/datasets/whisper_prep_dataset/train/created_dataset/dump/xbrsbYaj-gU/2489340.mp3,-0.014647801872342825,noise,в список дополнительной литературы. Благодарю вас за внимание.,<|0.48|> список<|0.92|><|0.92|> дополнительной<|1.60|><|1.60|> литературы.<|2.32|><|2.90|> Благодарю<|3.32|><|3.32|> вас<|3.58|><|3.58|> за<|3.78|><|3.78|> внимание.<|4.24|>,False
548,/workspace/datasets/whisper_prep_dataset/train/created_dataset/dump/X2l-vaKoIBE/1933620.mp3,-0.01530354894283745,term,"Сложность заключается в достаточно нетривиальном геологическом строении и достаточно низкими проницаемостями. В обратную сторону мы имеем достаточно большие запасы газа в этих отложениях и, как следствие, большой интерес к этому направлению. Все эти современные вызовы диктуют необходимость кросс-функциональных, даже не междисциплинарных, а кросс-функциональных подходов","<|0.00|> Сложность заключается в достаточно нетривиальном геологическом<|4.28|><|4.28|> строении.<|5.04|><|6.04|> И достаточно низкими проницаемостями.<|9.78|><|10.56|> В обратную сторону мы имеем достаточно большие запасы газа<|13.54|><|13.54|> в этих отложениях.<|14.50|><|14.92|> И, как следствие, большой интерес к этому направлению.<|17.82|><|18.52|> Все эти современные вызовы диктуют необходимость кросс-функциональных,<|25.04|><|25.22|> даже не междисциплинарных, а кросс-функциональных подходов<|28.32|>",False
856,/workspace/datasets/whisper_prep_dataset/train/created_dataset/dump/TyJ9baht8kA/144400.mp3,-0.015696064474468585,term,"Буровой раствор, находящийся в скважине, вытесняется из нее по трубам. Если после замены бурового раствора водой вызвать приток в скважине не удается, то переходит на промывку скважины нефтью. Аэрация – это процесс смешения жидкости с пузырьками сжатого газа воздуха. При аэрации за счет постепенного смешения сжатого газа","<|0.00|> Буровой раствор, находящийся в скважине, вытесняется из нее<|4.08|><|4.08|> по трубам.<|5.08|><|5.68|> Если после замены бурового раствора водой вызвать приток в<|9.34|><|9.34|> скважине не удается, то переходит на промывку скважины нефтью.<|14.28|><|15.38|> Аэрация – это процесс смешения жидкости с пузырьками сжатого<|19.76|><|19.76|> газа воздуха.<|21.40|><|21.40|> При аэрации за счет постепенного смешения сжатого газа<|25.52|>",False
19,/workspace/datasets/whisper_prep_dataset/train/created_dataset/dump/WfcldGf1Xoc/302050.mp3,-0.015840145888634853,term,"системой для улучшения охвата пласта вытеснением, а также для выработки запасов из отдельных линз или участков пласта в застойных зон, на которые не распространяется влияние закачки от ближайших нагнетательных рядов. Под нагнетание используют одну из добывающих скважин, расположенную рационально по отношению к окружающим добывающим скважинам и в зоне пласта с повышенной проницаемостью.","<|0.00|> системой для улучшения охвата пласта вытеснением, а также<|3.96|><|3.96|> для выработки запасов из отдельных линз или участков пласта<|7.64|><|7.64|> в застойных зон, на которые не распространяется влияние закачки<|11.64|><|11.64|> от ближайших нагнетательных рядов.<|14.32|><|14.32|> Под нагнетание используют одну из добывающих скважин, расположенную<|19.06|><|19.06|> рационально по отношению к окружающим добывающим скважинам<|23.08|><|23.08|> и в зоне пласта с повышенной проницаемостью.<|26.56|>",False
84,/workspace/datasets/whisper_prep_dataset/train/created_dataset/dump/xbrsbYaj-gU/1520040.mp3,-0.016741680752602406,term,"могут быть многочисленные технические и технологические причины, приводящие к целесообразности или нецелесообразности применения отдельных вариантов выделения объектов. Например, если скважин, эксплуатирующих какой-то пласт или группу пластов, выделенные в один объект разработки, предполагается отбирать настолько значительные дебиты жидкости, что они будут предельными для современных средств эксплуатации скважин,","<|0.00|> Могут быть многочисленные технические и технологические<|4.12|><|4.12|> причины,<|4.66|><|5.08|> приводящие к целесообразности или нецелесообразности<|8.76|><|8.76|> применения отдельных вариантов выделения объектов.<|11.66|><|12.08|> Например, если скважин, эксплуатирующих какой-то пласт или<|16.16|><|16.16|> группу пластов,<|17.08|><|17.54|> выделенные в один объект разработки, предполагается отбирать<|20.74|><|20.74|> настолько значительные дебиты жидкости,<|23.68|><|24.12|> что они будут предельными для современных средств эксплуатации<|27.72|><|27.72|> скважин,<|28.40|>",False
